{
  "allowlistDigest": "sha256:05235c60dd61b239f3ac6a367b4fd6469008d766270002a235df4f54b02e217c",
  "c8s": {
    "attestationTargets": [
      {
        "identity": "gateway-db0b6ee",
        "target": "gateway",
        "workload": "gateway-db0b6ee"
      },
      {
        "identity": "inference-worker-0-tool-calls-v1",
        "target": "inference-worker-0",
        "workload": "inference-worker-0-tool-calls-v1"
      },
      {
        "identity": "inference-worker-1-tool-calls-v1",
        "target": "inference-worker-1",
        "workload": "inference-worker-1-tool-calls-v1"
      },
      {
        "identity": "kube-state-metrics-a941ea9",
        "target": "kube-state-metrics",
        "workload": "kube-state-metrics-a941ea9"
      },
      {
        "identity": "metrics-collector-a941ea9",
        "target": "metrics-collector",
        "workload": "metrics-collector-a941ea9"
      },
      {
        "identity": "sglang-router-684393d",
        "target": "sglang-router",
        "workload": "sglang-router-684393d"
      }
    ],
    "frontDoorWorkload": "c8s-tls-lb",
    "imageTag": "079aeb4",
    "installInputDigest": "sha256:59820689af5486f696d6260c7ff941299dae67ef5cb502151ce926f90cfc70af",
    "measurements": {
      "mrtd": "9309eaae9c151e766de0f97b1d1aaeb76b8c8c366080803943fb566521c8f0cf00a142d8b7b0683ed1d42c5a27198ba1",
      "rtmr1": "95f6515ef906192daabd8f203290b788c702f0a963335ec3173aa199e8cf5faad07450485e81af80351bb5593b6486fd",
      "rtmr2": "cd3b67c1888624ee97af2676dfed59348dd3299094d4f763b6a9ea28e015fa150885ac2551607f1d450c5e24cd827a1d"
    },
    "policyMode": "static",
    "sourceCommit": "079aeb48c4d523aa7500b4bd78f0283b2d12e317",
    "systemFloor": [
      {
        "image": "ghcr.io/confidential-dot-ai/attestation-api@sha256:8dfb4db34d966374c3dbd81548c532a2015123d41f3aab553cea1cb7a327c8e9",
        "name": "attestation-api"
      },
      {
        "image": "ghcr.io/confidential-dot-ai/c8s-operator@sha256:5e1a8e3a90e29ba4240a4ac37e92062af17d19f0ec62167ceb04f08180687723",
        "name": "c8s-operator"
      },
      {
        "image": "ghcr.io/confidential-dot-ai/cds@sha256:a2aada807121dd7f34ec86e1ae64e86104177b4da89eddb2839174c03aed7404",
        "name": "cds"
      },
      {
        "image": "nginxinc/nginx-unprivileged@sha256:11f3f6249b4ae3d7a4ec2a51797060107b88ead52b33b6ed3c6c33f55ca96200",
        "name": "nginx"
      },
      {
        "image": "ghcr.io/confidential-dot-ai/nri-image-policy@sha256:7700f5490bfde2342b1368af5b28e816fdd2a3b723648360149b5d86e456054e",
        "name": "nri-image-policy"
      },
      {
        "image": "ghcr.io/confidential-dot-ai/ratls-mesh@sha256:88c5fb9a1b274c25c29480cfec4272e8babd083fb4af69392a34de6745f05760",
        "name": "ratls-mesh"
      },
      {
        "image": "ghcr.io/tailscale/tailscale@sha256:321ce041508c19079b57a28b6666c8d81ab0b08accc0a2585b3ab663d557ac24",
        "name": "tailscale-control-plane"
      },
      {
        "image": "ghcr.io/confidential-dot-ai/volumed@sha256:47cac3bed60e2a142e4aa126c399eb18c339b32e557cce5f23bd41438e9df85f",
        "name": "volumed"
      }
    ]
  },
  "model": {
    "dmVerityRoot": "9186a0d1382c9fbb36d3aade93da7a11ff8680e9742a783f5b2ee09b11703aad",
    "mountVerification": {
      "expectedFiles": {
        ".model-lock-local-manifest.json": "cd9eecd89a3d31dedd7b707158e86ebeab241c68d55e9661d3efa508015a697c",
        "config.json": "6c8f3d2d3b48707541b88f32f22ef3f0f8a6b57d8523281e2b8d3cdb0ae9a023",
        "model.safetensors.index.json": "98efab455cf08dfbbbaaba6f570e1bf10bf927d2b4c3c453a59c2f6f0e3be92b",
        "tokenizer_config.json": "6ac8c8dc065ed118161d02dd532749ae3f52c243deac27872134fae2f50d8547"
      },
      "path": "/models/dsv4",
      "pollSeconds": 1,
      "revisionMetadata": ".model-lock-local-manifest.json",
      "timeoutSeconds": 900
    },
    "repository": "deepseek-ai/DeepSeek-V4-Flash-0731",
    "revision": "9e165c30e2704aec5d9d593cce3eebd58bbef1cb"
  },
  "node": {
    "evidenceArtifactDigest": "sha256:026e62bf69fe05eecfc8809c6be0539d098f3d42be8a6c8f196200d018b50a7c",
    "image": {
      "digest": "sha256:cdc98a230169ff62599084f8f791c022e983c803c0d950c6f43e38d2009dfe3d",
      "reference": "ghcr.io/confidential-dot-ai/node-guest-base"
    },
    "sourceCommit": "fd6355414f79c6b3d3657e1abca04a6edc90550f"
  },
  "release": {
    "environment": "production",
    "name": "v0.13.27-static-attestation-20260910"
  },
  "releaseTrust": {
    "policyPath": "releases/trust/release-signing-policy.json",
    "policySha256": "sha256:8fac498dce2d17c44f191498a352556950c71b9f252e28bb6dbe421462f08a98",
    "signatureType": "sigstore-keyless"
  },
  "schemaVersion": 2,
  "source": {
    "commit": "de1acc32de3219f61ca31d0ea063ae419a395176",
    "repository": "https://github.com/confidential-dot-ai/confidential-inference"
  },
  "workloads": [
    {
      "argv": [
        "/usr/local/bin/confidential-gateway"
      ],
      "build": {
        "commit": "47b27d4cc10c046162f5498f098503d75e16e0af",
        "context": ".",
        "dockerfile": "images/gateway/Dockerfile",
        "platform": "linux/amd64",
        "repository": "https://github.com/confidential-dot-ai/confidential-inference"
      },
      "image": {
        "digest": "sha256:ea29a58f423ee4e8652450c2e1b2bf78c5b2bab8d12f977ad3a6772d104ba552",
        "reference": "ghcr.io/confidential-dot-ai/confidential-inference/gateway"
      },
      "name": "gateway"
    },
    {
      "argv": [
        "/c8s",
        "cds-attest",
        "--host=0.0.0.0",
        "--port=8800",
        "--platform=tdx",
        "--front-door-mode=webpki",
        "--expected-workload=gateway-db0b6ee",
        "--attestation-api-url=unix:///run/c8s/workload-claims/attestation-api.sock",
        "--serving-cert-file=/etc/c8s/certs/tls.crt",
        "--mesh-identity-cert-file=/etc/c8s/certs/tls.crt",
        "--mesh-identity-key-file=/etc/c8s/certs/tls.key",
        "--mesh-identity-ca-file=/etc/c8s/certs/tls.crt"
      ],
      "image": {
        "digest": "sha256:5e1a8e3a90e29ba4240a4ac37e92062af17d19f0ec62167ceb04f08180687723",
        "reference": "ghcr.io/confidential-dot-ai/c8s-operator"
      },
      "name": "gateway-cds-attest"
    },
    {
      "argv": [
        "/workload-proxy",
        "--mode=client",
        "--listen=127.0.0.1:30001",
        "--upstream=sglang-router:9443",
        "--peer-workload=sglang-router-684393d",
        "--cert-file=/etc/c8s/certs/tls.crt",
        "--key-file=/etc/c8s/certs/tls.key",
        "--ca-file=/etc/c8s/certs/ca.crt"
      ],
      "image": {
        "digest": "sha256:5e1a8e3a90e29ba4240a4ac37e92062af17d19f0ec62167ceb04f08180687723",
        "reference": "ghcr.io/confidential-dot-ai/c8s-operator"
      },
      "name": "gateway-router-workload-proxy"
    },
    {
      "argv": [
        "/bin/sh",
        "/opt/confidential-inference/mount.sh"
      ],
      "image": {
        "digest": "sha256:1e0a86e57d247923571b75e0aaf48a1449cf8c543d51fb3e07a4a7d7bfa79316",
        "reference": "docker.io/library/ubuntu"
      },
      "name": "gateway-state-mounter"
    },
    {
      "argv": [
        "/usr/local/bin/wait-for-model",
        "--path=/models/dsv4",
        "--timeout-seconds=900",
        "--poll-seconds=1",
        "--expected-repository=deepseek-ai/DeepSeek-V4-Flash-0731",
        "--expected-revision=9e165c30e2704aec5d9d593cce3eebd58bbef1cb",
        "--revision-metadata=.model-lock-local-manifest.json",
        "--expected-file=.model-lock-local-manifest.json=cd9eecd89a3d31dedd7b707158e86ebeab241c68d55e9661d3efa508015a697c",
        "--expected-file=config.json=6c8f3d2d3b48707541b88f32f22ef3f0f8a6b57d8523281e2b8d3cdb0ae9a023",
        "--expected-file=model.safetensors.index.json=98efab455cf08dfbbbaaba6f570e1bf10bf927d2b4c3c453a59c2f6f0e3be92b",
        "--expected-file=tokenizer_config.json=6ac8c8dc065ed118161d02dd532749ae3f52c243deac27872134fae2f50d8547",
        "--gpu-metrics-port=29000",
        "--gpu-metrics-worker=sglang-0",
        "--",
        "python3",
        "-m",
        "sglang.launch_server",
        "--model-path=/models/dsv4",
        "--served-model-name=deepseek-ai/DeepSeek-V4-Flash-0731",
        "--revision=9e165c30e2704aec5d9d593cce3eebd58bbef1cb",
        "--tool-call-parser=deepseekv4",
        "--tp=4",
        "--moe-runner-backend=flashinfer_mxfp4",
        "--speculative-algorithm=DSPARK",
        "--mem-fraction-static=0.90",
        "--chunked-prefill-size=4096",
        "--swa-full-tokens-ratio=0.1",
        "--trust-remote-code",
        "--enable-metrics",
        "--enable-cache-report",
        "--host=0.0.0.0",
        "--port=30000"
      ],
      "build": {
        "commit": "145a6e85332d575afce6185becea4dba9596a1c1",
        "context": "images/sglang",
        "dockerfile": "images/sglang/Dockerfile",
        "platform": "linux/amd64",
        "repository": "https://github.com/confidential-dot-ai/confidential-inference"
      },
      "gpu": {
        "architectures": [
          "BLACKWELL"
        ],
        "deviceCount": 8,
        "required": true
      },
      "image": {
        "digest": "sha256:2c9d540bd0b61648fb2e50d3a0ec244d0671f7314a8f9b43c51e91135739f81b",
        "reference": "ghcr.io/confidential-dot-ai/confidential-inference/sglang"
      },
      "modelDmVerityRoot": "9186a0d1382c9fbb36d3aade93da7a11ff8680e9742a783f5b2ee09b11703aad",
      "name": "inference-worker-0"
    },
    {
      "argv": [
        "/c8s",
        "cds-attest",
        "--host=0.0.0.0",
        "--port=8802",
        "--platform=tdx",
        "--front-door-mode=webpki",
        "--nvidia-gpu-evidence",
        "--expected-workload=inference-worker-0-tool-calls-v1",
        "--attestation-api-url=unix:///run/c8s/workload-claims/attestation-api.sock",
        "--serving-cert-file=/etc/c8s/certs/tls.crt",
        "--mesh-identity-cert-file=/etc/c8s/certs/tls.crt",
        "--mesh-identity-key-file=/etc/c8s/certs/tls.key",